"value","mes","year","paragraph"
"On the other hand, the process of consolidation of public finances is maintained, with a primary surplus expected to be reached at the end of 2019, as stipulated in the National Budget. In the external sector, foreign exchange-generating activities such as foreign direct investment and remittances have performed well, compensating for the recent moderation of tourism, induced by lower global demand and by the negative media campaign in the face of isolated cases in the sector. In this challenging international environment, the Dominican Republic has maintained the relative stability of the exchange rate, presenting a cumulative depreciation in the year of 2.0%, lower than that observed in the same period of the previous year and among the lowest among Latin American countries and emerging economies, as a result of the strength of macroeconomic fundamentals and credibility in its economic policies.","08","19",10
"The Central Bank of the Dominican Republic reaffirms its commitment to drive monetary policy towards achieving its inflation target and the smooth functioning of financial and payment systems, thus contributing to the maintenance of macroeconomic stability. In this sense, the institution will continue to monitor the moderation of the world economy and factors of uncertainty both externally and internally and its impact on aggregate demand, being prepared to continue to react in a timely manner to factors that may lead to deviations from inflation targets and affect Dominican economic growth.","08","19",11
"The Central Bank of the Dominican Republic, at its Monetary Policy Meeting of September 2012, decided to leave its Monetary Policy Interest Rate unchanged at 5.00% per annum. At the same time, it decided to keep its Lombard Rate unchanged at current levels of 7.00% per year.","09","12",1
"The decision regarding the reference interest rate takes into account that the most recent projections place the inflation rate below the lower limit of the 2012 target, but within the tolerance range of the target of 5% <U+00B1> 1% for 2013. In the month of August, the interannual rate of inflation rose to 2.16%, while the interannual core inflation stood at 3.50%. The forecast models do not foresee significant inflationary pressures in the monetary policy horizon.","09","12",2
"In the external context, the recent measures of monetary easing in the United States and the announcement that its monetary policy rate would remain close to zero until 2015, has sent the signal of moderate growth with low inflationary pressures, which has been reflected in a depreciation of the dollar and in a moderation in oil prices. Likewise, capital flows to emerging economies are increasing, while prospects for recession in the Eurozone continue for the rest of the year and part of 2013.","09","12",3
"In the domestic sphere, production and domestic demand continue below their long-term trend, while market interest rates begin to fall as a result of the measures adopted in recent months, as the transmission mechanism of the monetary politics. If this trend continues, an upturn in private credit and economic activity is expected, which, together with the reordering of public finances through a comprehensive fiscal reform within the framework of a new agreement with the IMF, would help to improve the conditions macroeconomic indicators for the coming quarters.","09","12",4
"The Central Bank reaffirms its commitment to conduct monetary policy to achieve its inflation target, while continuing to monitor the evolution of the world economy and the domestic situation in order to react timely to risks on price stability and good functioning of the financial and payment systems.","09","12",5
"In its monetary policy meeting of September 2013, the Central Bank of the Dominican Republic decided to keep its Monetary Policy Rate (MPR) unchanged at 6.25% per annum.","09","13",1
"The decision regarding the reference rate takes into account the inflation projections that indicate that there are no significant deviations from the goals established in the Monetary Program, both for 2013 (5.0% <U+00B1> 1.0%) and for 2014 (4.5% <U+00B1> 1.0%). In August, the interannual inflation rate stood at 5.30%, accumulating 3.07% in the first eight months of this year. On a monthly basis, inflation reached 0.66% in August. In addition, core inflation, which is the price indicator that best reflects monetary conditions, decreased in interannual terms from 5.25% in July to 4.70% in August, below the central value of the target range for 2013.","09","13",2
"In the external context, the Federal Reserve Bank of the United States of America maintained its policy of quantitative easing without change, which caused a decrease in the market interest rates in that economy, as well as the reversal of the flows of capital from emerging economies and the appreciation of the dollar. Indicators of expectations of the private sector in the Euro Zone show a perception that the economy of that bloc of countries could be emerging from recession in the coming months, driven by the growth of the largest economies such as Germany and France. In Latin America, according to the latest Consensus Forecast report, a 2.6% growth is projected for the current year, which implies a moderation compared to the average of recent years. Regarding international prices, a more stable behavior is observed in raw materials, although they still remain above their historical averages. In the domestic sphere, economic activity shows signs of improvement. Preliminary figures of the Monthly Indicator of Economic Activity point to a growth trend, consistent with the projection of 3.0% of the Monetary Program. An important determinant of this behavior is the evolution of credit to the private sector in national currency, which has presented year-on-year growth of around 14.5% in the month of September and is expected to close the year close to 12.0%. In the fiscal sector, the government maintains a public investment program in line with its budget plan, while carrying out an expenditure policy consistent with meeting its deficit target of 2.8% of GDP, for the closing of the year.","09","13",3
"The decision to liberalize some RD $ 20,000 million of the legal reserve to the productive sectors has contributed notably to the dynamism of credit. In May-September, almost 80% of the amount to be liberalized had been placed (some RD $ 15.5 billion of the reserve), which has generated a multiplier effect in the financial system, reaching the total increase of private credit in national currency, more than RD $ 30,000 million, during that period. So far this year, since last December, private credit in national currency has grown around RD $ 38,000 million, a significant recovery compared to the same period last year, when there was a fall of approximately RD $ 5 billion. In interannual terms, September 2012-September 2013, private credit in national currency has expanded by RD $ 58,000 million, amount 4.3 times greater than the total placed a year before, between September 2011 and September 2012.","09","13",4
"The liquidity of the financial system continues to grow according to the provisions of the Monetary Program. In year-on-year terms, in September, the bills and coins issued and the circulating medium (M1) grew around 8.5% and 9.0%, respectively, rates consistent with the expected behavior of nominal GDP for the year 2013.","09","13",5
"The Central Bank reaffirms its commitment to conduct monetary policy to achieve its inflation target, while continuing to monitor the evolution of the world economy and the domestic situation in order to take the necessary measures against risks on price stability and the proper functioning of the financial and payment systems.","09","13",6
"At its monetary policy meeting for the month of September 2014, the Central Bank of the Dominican Republic decided to maintain its monetary policy interest rate at 6.25% per annum.","09","14",1
"The decision regarding the reference rate took into account the balance of risks around the inflation projections, as well as the performance of the main macroeconomic indicators, market expectations and the relevant international environment for the Dominican economy. Last August, the year-on-year rate of inflation fell to 3.13%, below the lower end of the target range of 4.5% <U+00B1> 1% for 2014. Accumulated inflation in the first eight months of the year is 2.33%. Likewise, the interannual core inflation, an indicator that collects information on the movement of prices of monetary origin, was reduced to 3.26%.","09","14",2
"In the external context, the growth of the United States of America (USA) was revised upwards to 4.6% during the second quarter of the year. The Federal Reserve Bank continues to implement its gradual policy of moderation of monetary stimulus, implemented during the international financial crisis. The latest forecasts of the Consensus Forecast suggest that the US would grow 2.1% in 2014 and 3.1% in 2015. This indicates that the recovery of the US economy would continue gradually, with no anticipated increases in interest rates until at least the middle of next year. In the case of the Eurozone, although the economy showed signs of weakening in its economic activity during the second quarter of the year, positive growth is expected around 0.9% for the end of 2014 and 1.4% for 2015, consolidating its process of Economic recovery. Regarding Latin America, the Consensus Forecast revised its economic growth projection to 1.4% for this year, as a result of signs of recession in some of the large economies such as Brazil, Argentina and Venezuela.","09","14",3
"In the domestic sphere, the accumulated economic growth as of August amounted to 6.9%, according to the Monthly Indicator of Economic Activity (IMAE). For 2015, the macroeconomic framework contemplates a growth of 5.0%, around the potential product. Market interest rates remain below their historical average, while credit to the private sector in national currency expands at a year-on-year rate of 14.9%. On the fiscal policy side, budget execution points to a smaller deficit than expected in 2014, because revenues grow at an annual rate higher than that of public spending. The Government's strategy to reduce the fiscal deficit would continue in 2015, as a way to make public finances more sustainable. Regarding the external sector, a current account deficit of around 3.9% of GDP is projected for the current year. The moderation in the current account deficit has contributed to the fact that the depreciation of the exchange rate, so far this year, is only 2.4%. It is expected that next year the greater dynamism observed in the sectors that generate foreign exchange will continue, which would help maintain relative stability in the exchange market.","09","14",4
"The Central Bank confirms its commitment to implement monetary policy aimed at achieving its inflation target and affirms that, if necessary, it can assume a different policy stance as the world economy evolves and the domestic situation in the face of potential risks that affect stability. of prices, growth and good functioning of the financial and payment systems.","09","14",5
"At its monetary policy meeting in September 2015, the Central Bank of the Dominican Republic (BCRD) decided to keep its monetary policy interest rate at 5.00% per annum.","09","15",1
"The decision on the reference rate was adopted after analyzing the balance of risks around inflation projections, market expectations, the national macroeconomic outlook and the relevant international environment for the Dominican economy. It was observed that in the month of August the interannual rate of inflation fell to 0.43%; in cumulative terms, inflation stood at 1.17% in the eighth month of the year. In the same way, core inflation, an indicator that reflects the monetary conditions of the economy, fell to 1.99% year-on-year. Forecasts continue to indicate that inflation would remain below the lower limit of the target set in the Monetary Program for 2015, gradually converging towards the center of the range of 4.0% <U+00B1> 1.0% for 2016.","09","15",2
"In the external environment, the behavior of the international economy continues to be determined by the improved performance of the industrialized countries, while the large emerging market economies are affected by the cycle of falling commodity prices. The gradual deceleration of the Chinese economy and the weakness of large emerging economies such as Russia and Brazil, induce the risks of global economic growth downward. Taking this into consideration, the Federal Reserve Bank left its monetary policy rate unchanged at last September's meeting, despite the notable expansion of production in the United States of America (USA). In the international exchange markets, the tendency to the appreciation of the dollar is maintained, while oil prices continue below the average of recent years. This behavior of international markets has reduced inflation in the United States and Europe, in contrast to what happened in the countries of Latin America that export raw materials, where exchange rate depreciation has generated higher inflation.","09","15",3
"According to Consensus Forecast, the US economy would grow 2.5% in 2015, while the Eurozone would expand by 1.4% in the same period. Both in the United States and in the Euro Zone, inflation would remain low, standing at around 0.2% at the end of the year. In 2016, growth in the United States would increase to 2.7%, while in the Euro Zone it would be 1.7%. In the case of Latin America, consensus projects a contraction of 0.6% in 2015, recovering gradually in 2016 until reaching an expansion of 0.8% at the end of that year. This scenario would be determined by the projected contraction of the economies of Brazil (-2.6%) and Venezuela (-7.4%), as well as the low growth in Argentina (0.7%) and the slowdown in the growth of other major commodities exporters, such as this is the case of Chile (2.2%) and Peru (2.8%).","09","15",4
"In the domestic sphere, Dominican economic activity continues to show a high dynamism in the short term, as a result of the notable improvement in macroeconomic fundamentals. In that sense, the cycle trend of the monthly indicator of economic activity (IMAE) presents a year-on-year growth rate of 6.2% in July, while loans to the private sector grew around 10.7% in the month of September. In the context of fiscal policy, the government has proposed a budget for 2016 in which the process of fiscal consolidation initiated three years ago is maintained by contemplating a primary surplus of around 0.7% of GDP and a deficit for the year equivalent to 2.3% of GDP. Likewise, the external sector presents a tendency to balance in the current account balance thanks to the drop in oil prices and the better performance of tourism, remittances and free zones. These positive results in the fiscal and external accounts, would facilitate the accumulation of reserves and the relative stability of the exchange market.","09","15",5
"The Central Bank reaffirms its commitment to implement monetary policy aimed at achieving its inflation target, while continuing to monitor the evolution of the world economy and the domestic situation, in order to take the necessary measures against risks to the stability of the economy. prices and the proper functioning of the financial and payment systems.","09","15",6
"At its September 2016 monetary policy meeting, the Central Bank of the Dominican Republic decided to keep its monetary policy rate (MPR) at 5.0% per annum.","09","16",1
"The decision regarding the reference rate takes into account the balance of risks around inflation projections, market expectations, the domestic macroeconomic context, as well as the relevant international environment for the Dominican economy. In August, the interannual rate of inflation stood at 1.47%, while cumulative inflation reached 0.31% at the end of that month. Likewise, the interannual core inflation, related to monetary conditions, amounted to 1.73 percent.","09","16",2
"In the external context, the Federal Reserve Bank of the United States of America (FED) decided to maintain its TPM at its September meeting without change. However, within the FED, the arguments in favor of an increase in rates this year have been strengthened, indicating that the normalization of monetary policy could be resumed in the coming months. According to the Consensus Forecast's vision of the industrialized economies, the United States would be growing 1.5% in 2016, showing greater dynamism in 2017 with an expansion of the product around 2.3% year-on-year. The Euro Zone (ZE), on the other hand, would expand at interannual rates of around 1.5% in 2016, driven by the growth of economies such as Germany (1.8%) and Spain (3.0%). For 2017, incorporating the impact of Brexit on the economies of the region, the growth of the EZ would moderate to 1.3% year-on-year.","09","16",3
"In Latin America, Consensus Forecast corrected its growth projections for the current year from -0.5% year-on-year in August to -0.3% year-to-year in September. Despite this small improvement in projections, at least four major economies in the region would remain in recession: Venezuela (-10.1%); Brazil (-3.2%); Ecuador (-2.3%); and Argentina (-1.5%). An important recovery of Latin America is expected in 2017 with a growth of around 2.2%, leaving only the Venezuelan economy in recession (-2.6%). The large countries of the region would benefit from a moderate increase in commodity prices next year, while the smaller economies, such as those of Central America and the Caribbean, would face more favorable conditions for their exports, given the greater dynamism of United States, its main commercial partner.","09","16",4
"In the domestic sphere, economic activity and domestic demand are evolving positively. In January-August, the Monthly Indicator of Economic Activity (IMAE) shows real growth around 6.8% year-on-year, which indicates that the economy would be growing this year above its potential. Credit to the private sector in national currency shows a year-on-year growth rate of around 12.6% in September and continues to grow above the nominal product expansion. In the fiscal sector, public spending has slowed down in the second half of the year and it is expected, according to the most recent budget update, that at the end of 2016 the deficit will approach 2.7% of GDP and for 2017 it stood at 2.3% of GDP. On the side of external sector accounts, the current account deficit would end 2016 with a deficit of around 1.7% of GDP. Under this scenario, conditions are favorable for accumulating international reserves and maintaining the relative stability of the foreign exchange market.","09","16",5
"The Central Bank reaffirms its commitment to continue conducting monetary policy aimed at achieving its inflation target, while continuing to monitor the evolution of the world economy and the domestic situation, in order to take the necessary measures against risks to stability of prices and the proper functioning of the financial and payment systems.","09","16",6
"At its monetary policy meeting for September 2017, the Central Bank of the Dominican Republic (BCRD) decided to maintain its monetary policy interest rate at 5.25% per annum.","09","17",1
"The decision on the reference rate was taken after a comprehensive review of the balance of risks around the inflation projections, including the evolution of the main national macroeconomic indicators, the international environment relevant to the Dominican economy and the expectations of the domestic market . The monthly rate of inflation in the month of August amounted to 0.57%, so the accumulated rate to the eighth month of the year stood at 1.77%. Likewise, year-on-year inflation climbed to 3.18%, placing it within the target range of 4.0% <U+00B1> 1.0% of the Monetary Program. Additionally, core inflation, which reflects the monetary conditions of the economy, amounted to 2.27% year-on-year. The projections indicate that inflation would remain within the target range at the end of the year.","09","17",2
"In the external context, the advanced economies experience an acceleration in their growth for the sixth consecutive quarter. The outlook is favorable for the United States of America (USA), the Euro Zone (ZE) and Japan. According to the Consensus Forecast, the US would grow 2.2% in 2017, after the annualized interquarterly growth of April-June, which reached 3.1%, was revised upwards. By 2018, the US is projected to grow 2.4%, in a context of normalization of monetary policy. As for the EZ, it is projected that the product would expand by 2.1% in 2017 and 1.8% in 2018. The dynamism of the advanced economies would have a positive impact on world economic activity, which would grow 3.0% in 2017 and 3.1% in 2018. It should be noted that the inflationary pressures of the developed economies remain relatively low, projecting 2.0% for the US in 2017 and 1.9% in 2018, as well as inflation rates of 1.5% in 2017 and 1.3% in 2018 for the ZE.","09","17",3
"On the other hand, in Latin America (AL) there continues to be a gradual economic recovery, with the exception of Venezuela. In the case of Brazil, the largest economy in the region, it would grow 0.7% in 2017 and 2.3% in 2018. On the other hand, Mexico would expand 2.2% in both years, while Chile would grow 1.4% in 2017 and 2.9% in 2018 The projections for Latin America have been revised upwards and reflect that the economy of the region would expand 1.7% in 2017 and 2.6% in 2018, driven by more favorable terms of trade.","09","17",4
"In the domestic sphere, economic activity reacted favorably after the expansionary measures taken at the end of July, such as the reduction of the monetary policy rate by 50 basis points and the reduction in the legal reserve by 2.2 percentage points. It should be noted that credit to the private sector in national currency has increased by RD $ 16,000 million since these measures were taken, so that positive prospects remain for the revitalization of domestic demand for the rest of 2017. In that sense, Growth is expected to approach its potential by the end of the year, even in a context of recovery from the damage caused by recent climate events. It is important to note that the World Bank approved a loan of US $ 150 million for the Dominican Republic with the purpose of facing natural disasters, which would facilitate the reactivation of economic activity during the last quarter of the year.","09","17",5
"In the fiscal sector, a boost to public spending was recently announced, implying a more active fiscal policy for the rest of the year. Notwithstanding this decision, the Government announced that it would meet the deficit target of 2.3% of GDP, established in the National Budget for 2017. On the other hand, the external sector maintains its dynamism, contributing to the increase of foreign exchange earnings and creating a favorable environment for the relative stability of the foreign exchange market and for the accumulation of international reserves.","09","17",6
"The Central Bank of the Dominican Republic reaffirms its commitment to conduct monetary policy to achieve its inflation target and maintain macroeconomic stability. In that sense, it will continue to monitor the evolution of the world economy and the domestic situation, in order to adopt the necessary measures against possible risks on price stability and the proper functioning of the financial and payment systems.","09","17",7
"At its monetary policy meeting in September 2018, the Central Bank of the Dominican Republic (BCRD) decided to keep its monetary policy interest rate at 5.50% per annum.","09","18",1
"The decision to leave the reference rate unchanged was based on a detailed analysis of the balance of risks around inflation projections, including the main national macroeconomic indicators, market expectations, the relevant international environment and medium-term forecasts. . In recent months, inflationary pressures have moderated. In that sense, the cumulative inflation to the month of August stood at 1.44%, which is why inter-annual inflation fell from 4.43% in the month of July to 3.87% in August, below the central value of the goal of 4.0% <U+00B1> 1.0% established in the Monetary Program. Core inflation, linked to monetary conditions, fell to 2.59% year-on-year in August. In addition, the forecast system indicates that inflation would remain within the target range in the two-year monetary policy horizon.","09","18",2
"In the external context, the growth prospects of the world economy continue at around 3.3% during 2018 and 3.1% in 2019. According to Consensus Forecast, the United States of America (USA) would grow 2.9% in 2018 and 2.6% in 2019. Given the dynamics of expansion and full employment of that economy, the monetary policy in the US continues with the process of normalization, gradually withdrawing the monetary stimulus in force since the global financial crisis. Under these conditions, market interest rates tend to rise and the US dollar appreciates.","09","18",3
"On the other hand, the economy of the set of countries that make up the Euro Zone (ZE) would grow 2.1% in 2018 and 1.8% in 2019, while Japan would expand by 1.1% in 2018 and 1.2% in 2019, according to the Consensus Forecast. Given that inflationary pressures remain moderate in these countries, the monetary policy stance would remain expansive in the coming months.","09","18",4
