"value","mes","year","paragraph"
"The Central Bank of the Dominican Republic, in its Monetary Policy meeting of January 2012, decided to keep its Monetary Policy Rate unchanged at 6.75% per annum. At the same time, it decided to leave the Lombard Interest Rate unchanged at 9.0% per annum.","01","12",1
"The decision regarding the reference rate is based on the fact that no deviations are foreseen for the inflation projection with respect to the target and for the prospects of the main determinants of inflation. For 2012, the Monetary Board, under the new explicit inflation targeting (EMI) scheme, approved a goal of 5.5% <U+00B1> 1% for this indicator. In December 2011, monthly inflation was 0.1%, while the year-on-year rate reached 7.8%. In addition, the interannual core inflation rose to 5.2% at the end of the year.","01","12",2
"In the external context, both the IMF and the Consensus Forecast maintain their perspectives of moderation in the growth of the world economy. The projections suggest that the United States would continue its path of incipient recovery, while Europe could be entering recession in 2012. The solution of economic policy in the eurozone seems to confront a dilemma between fiscal austerity and economic growth, which makes it difficult to correct the process of debt crisis and fiscal sustainability of that monetary union, as discussed at the recent World Economic Forum in Davos. However, it is important to note that the European Union recently approved a fiscal rule that would allow the sustainability of public accounts in the long term.","01","12",3
"On the other hand, forecasts show that emerging economies would be slowing down while international financial conditions remain restricted. In that sense, China would be growing below the average of recent years, while the growth forecasts for Latin America are corrected to the downside. The prices of raw materials remain high amid geopolitical tensions in the Middle East.","01","12",4
"In the domestic sphere, private credit, economic activity and inflation evolve in accordance with the projections of the recent Monetary Policy Report. Credit to the private sector continues to expand at a rate close to projected nominal GDP, indicating that domestic demand preserves its growth. At the same time, the forecasts point to a convergence of interannual inflation to the target during the first quarter of 2012, which indicates that even in the middle of an electoral cycle, price stability and the continuity of macroeconomic policies would be maintained, creating a environment of certainty that facilitates the decision making of private economic agents.","01","12",5
"The Central Bank will continue to monitor the evolution of the global and domestic economy in order to react in a timely manner to risks regarding price stability and the proper functioning of the financial and payment systems.","01","12",6
"The Monetary Board, through the second resolution of December 20, 2012, decided to modify the interest rate corridor, formed by the rates of short-term remunerated deposits (overnight) and Lombarda, with which it had operated its policy during the last years. In this sense, it established that from now on the Monetary Policy Interest Rate of the Central Bank (TPM) will be exclusively a Reference Rate of the 1-Day Liquidity Operations performed by the institution, instead of the rate of paid deposits of the Central Bank. short term, which had fulfilled that role since 2005.In the external context, economic activity in the United States of America recorded a slight contraction of 0.1% in the fourth quarter of 2012, closing the year at 2.2%. For 2013, an expansion of 2.0% is expected according to the Economic Consensus (Consensus Forecast). The fiscal risks of the United States have moderated temporarily, while in the Euro Zone recessive conditions persist, estimating a fall of 0.4% by the end of 2012. Additionally, there is a loss of dynamism in important countries in the area, particularly Germany and France. On the other hand, the Economic Consensus predicts that Latin America's growth would be 2.7% in 2012. In most of the countries of the region, monetary policy maintains a neutral stance. International financial conditions have improved relatively and prices of primary goods remain above their historical levels. In the domestic sphere, production and domestic demand behave as predicted in the most recent Monetary Policy Report. Economic activity grew in 2012 at around 4.0%, higher than the average for Latin America. This growth indicates a moderate recovery in the second half of the year, but staying below its long-term trend. During this year, production will remain below its potential, recovering its path from next year, supported by an improvement in private consumption and investment, as total credit is recovered and economic activity is boosted.Regarding the possible impact on domestic prices, stemming from the implementation of the fiscal reform, the Central Bank estimates that its effect would have a transitory and one-off nature, so that inflation would remain around the target of this year.","01","13",1
"The Central Bank reaffirms its commitment to conduct monetary policy to achieve its inflation target, while continuing to monitor the evolution of the world economy and the domestic situation in order to react timely to risks on price stability and good functioning of the financial and payment systems.","01","13",2
"At its monetary policy meeting in January 2014, the Central Bank of the Dominican Republic decided to maintain the reference rate at 6.25% per annum.","01","14",1
"The decision regarding the monetary policy rate took into account the balance of risks around the inflation projections, as well as market expectations. The year-on-year inflation rate closed at 3.88% in December, decreasing for the fourth consecutive month. This result was slightly below the lower limit of the target range of 5.0% <U+00B1> 1.0%. Additionally, the interannual core inflation, which is associated with inflationary pressures of monetary origin, fell to 4.42%, closing below the central value of the target.","01","14",2
"In the external context, the conditions of the world economy are characterized by a process of gradual recovery, based on a better performance of the developed countries, particularly the United States of America (USA), which grew 3.2% in the last quarter of 2013 and 1.9% throughout the year, reducing the unemployment rate from 7.9% in December 2012 to 6.7% in December 2013. According to Consensus Forecast, the US economy would grow 2.8% in 2014, while the Euro Zone would expand by 1.0%, leaving behind the recessive stage of the economic cycle.","01","14",3
"The gradual reduction of the monetary stimulus by the Federal Reserve (FED), reducing its monthly purchases of financial assets to inject liquidity in US $ 20,000 million, would be restricting international financial conditions and provoking capital returns to the industrialized economies. In this context, some of the larger emerging economies such as Argentina, Brazil, India, Turkey and South Africa, mostly exporters of commodities, have experienced exchange rate pressures, which has led their central banks to tighten monetary policy stance through increases in interest rates, liquidity restrictions and interventions in the foreign exchange market, to face possible effects on inflation.","01","14",4
"It is important to point out that given the greater growth of production and employment in the US, there is a consensus among the governors of the FED that there will be no increases in the reference rate of monetary policy, at least until 2015. In that sense, the The gradual withdrawal of the monetary stimulus and the temporary volatility it has caused in the international capital markets, would have minimal effects on the financial and exchange markets of the smaller economies, with good macroeconomic fundamentals and without active participation in the global financial markets, as it is the case of the Dominican Republic. However, the greater dynamism in the economic activity of the United States, the country's main trading partner, would have a positive impact on Dominican economic growth, through exports and the flow of remittances, which would increase the supply of foreign currency in the country. Dominican exchange market, facilitating the maintenance of the relative stability of the exchange rate.","01","14",5
"Additionally, economic activity and domestic demand show remarkable dynamism as of the fourth quarter of 2013, growing by 7.2%, driven during this period by exports, investment and private consumption. Credit to the private sector in national currency continues to expand at a rate above the nominal product, while improving prospects for activities related to foreign trade. In this sense, it is expected that in this year the current account deficit of the balance of payments would continue to be corrected, which together with the strengthening of public finances, would contribute to improving the macroeconomic performance of the Dominican Republic and its perception of country risk.","01","14",6
"The Central Bank reaffirms its commitment to conduct monetary policy to achieve its inflation target, while continuing to monitor the evolution of the world economy and the domestic situation in order to take the necessary measures against risks on price stability and the proper functioning of the financial and payment systems.","01","14",7
"At its monetary policy meeting in January 2015, the Central Bank decided to keep its monetary policy interest rate (MPR) unchanged at 6.25% per annum, thus continuing with the neutral position it has maintained since August 2013.","01","15",1
"The decision on the benchmark interest rate was adopted after a thorough analysis of the risk balance around inflation projections, as well as the state of the economy based on its main indicators, market expectations and the international environment relevant. Last December, the year-on-year rate of inflation closed at 1.58%, while core inflation, related to the monetary conditions of the economy, was 2.97%. The inflation target from 2015 is 4.0% <U+00B1> 1%, according to the Monetary Program under the Inflation Targets, published at the end of last year. In the policy horizon, projections suggest that inflation would converge to the medium-term goal, while the economy would continue to grow close to its potential.","01","15",2
"In the international environment, the outlook for the growth of the world economy for 2015 remains moderate due to the projected trajectory for the Euro Zone, Japan and other industrialized economies. The United States of America shows a flattering outlook regarding the rate of expansion of its production due to the good performance of investment and private consumption. However, at its first monetary policy meeting in 2015, the Federal Reserve Bank maintained its MPR in the 0% -0.25% range, indicating that it would leave it at least until the third quarter of the year. In terms of emerging economies, Consensus Forecast has adjusted the growth projections for Asia and Latin America to 4.7% and 1.1%, respectively.","01","15",3
"On the other hand, the downward trend in the prices of the main primary goods (commodities), particularly fuels and industrial metals, continues, while international financial conditions have become more restrictive for emerging economies. As a result of the application of more expansive monetary policies in the Euro Zone, Japan and other economies with problems of economic growth, the US dollar has tended to appreciate worldwide and long-term interest rates in industrialized countries have been reduced. .","01","15",4
"In the domestic sphere, economic activity grew 7.1% in 2014 and it is expected that in 2015 it will continue to register an expansion close to its potential. In January, credit to the private sector in local currency was 15.6% in year-on-year terms, while total credit to the private sector, including foreign currency financing, would close this month with growth above 18.0% over the year. previous. In the fiscal part, adjustments continue and it is expected that by 2015 the Central Government deficit would be 2.4% of GDP. This process of fiscal consolidation would help strengthen the sustainability of the debt, which has improved with the operation of handling liabilities recently made by the Dominican Government with the Venezuelan company PDVSA. Additionally, external accounts will continue to strengthen in the current year and a current account deficit is projected for the end of 2015 in the range of 1.9% -2.1% of GDP. The continuous strengthening of the macroeconomic foundations of the Dominican economy facilitates the maintenance of the relative stability of the exchange rate and a greater accumulation of international reserves.","01","15",5
"The Central Bank reaffirms its commitment to implement monetary policy aimed at achieving its inflation target, while continuing to monitor the evolution of the world economy and the domestic situation, in order to take the necessary measures against risks to the stability of the economy. prices and the proper functioning of the financial and payment systems.","01","15",6
"At its monetary policy meeting for the month of January 2016, the Central Bank of the Dominican Republic (BCRD) decided to keep its monetary policy interest rate at 5.00% per annum.","01","16",1
"The decision on the reference rate has been made after an examination of the international environment relevant to the Dominican economy, as well as the domestic context taking into account the balance of risks around inflation projections and market expectations. It was observed that, as of December 2015, the interannual inflation rate reached 2.34%, below the lower limit of the goal established in the Monetary Program. At the same time, core inflation, which reflects the monetary conditions of the economy, amounted to 1.82% last year. Inflation is expected to converge gradually towards the center of the target range of 4.0% <U+00B1> 1.0% in the policy horizon.","01","16",2
"Externally, the most recent World Economic Outlook (WEO) of the International Monetary Fund (IMF) reduced the projections for world growth from 3.6% to 3.4% for 2016, due to the problems of the main emerging economies, particularly the emerging economies. net exporters of primary goods. After the increase of its monetary policy rate (MPR) in the month of December, the Federal Reserve Bank (FED) decided to keep its MPR unchanged in January, faced with greater uncertainty in the international financial markets. The slowdown in China and the recession in several of the leading emerging economies have pushed up the country risk premiums of these economies, while the US dollar has appreciated and the price of oil and stock indicators have declined.","01","16",3
"The most recent forecasts of the Consensus Forecast (CFC) highlight that world growth would be led by the expansion of the industrialized countries. In that sense, the United States of America (USA) would register an expansion of 2.4% in 2016 and 2.5% in 2017, while the Euro Zone (ZE) would continue consolidating its recovery with growth rates of 1.7% in 2016 and 2017. Inflation is expected to approach 2.0% in both the US and the ZE, while unemployment continues to fall.","01","16",4
"The macroeconomic conditions of emerging economies remain weak. The outlook points to a slight improvement in 2016. Latin America would present a growth of 0.3% in 2016, reaching a recovery in 2017, with an expansion of 2.3%. This result would be influenced by the evolution of Venezuela and Brazil, which would remain in recession until 2016, as well as by the moderation of growth in the net exporting economies of raw materials in the region.","01","16",5
"Domestically, economic activity continues to grow above its potential. Preliminary data show a GDP expansion rate of 7.0% in 2015. In the financial sector, private loans in local currency show a year-on-year growth of close to 12%, exceeding nominal product growth.","01","16",6
"The external accounts of the Dominican economy continue to improve in an environment of low oil prices and good performance in tourism revenues, remittances and exports from free zones. It is expected that by 2016, the current account deficit will remain around 2.0% of GDP. With regard to fiscal policy, the 2016 Budget contemplates maintaining discipline within the consolidation and sustainability efforts of public accounts. The adequate behavior of external and fiscal accounts in 2016 would facilitate the accumulation of reserves and the relative stability of the foreign exchange market.","01","16",7
"The Central Bank confirms its commitment to implement monetary policy aimed at achieving its inflation target, while continuing to monitor the evolution of the world economy and the domestic situation, in order to take the necessary measures against possible risks to stability of prices and the proper functioning of the financial and payment systems.","01","16",8
"At its monetary policy meeting for the month of January 2017, the Central Bank of the Dominican Republic (BCRD) decided to keep its monetary policy interest rate (MPR) at 5.50% per annum.","01","17",1
"The decision on the benchmark interest rate was adopted after a thorough analysis of the risk balance around inflation projections, as well as the state of the economy based on its main indicators, market expectations and the international environment. relevant. Last December, the year-on-year rate of inflation closed at 1.70%, while core inflation, related to the monetary conditions of the economy, was 1.89%. According to the projections, inflation would converge to the target range of 4% <U+00B1> 1% in the monetary policy horizon.","01","17",2
"In the external context, the growth prospects of the world economy are positive, with an estimated rate of expansion of 2.5% in 2016 and 2.8% in 2017, according to Consensus Forecast. This improvement in world economic activity would be influenced by the United States of America (USA), which according to preliminary figures recorded a growth of 1.6% in 2016, having experienced an expansion of 1.9% year-on-year in the last quarter. For the year 2017, a better performance of this economy is expected when projecting a growth of 2.3% associated with the positive expectation of the fiscal stimulus plan that the new government of that country would implement. The greater dynamism of the US, our main trading partner, should be a positive factor for our economy in 2017.","01","17",3
"Regarding the Euro Zone (ZE), it is estimated that the real product would expand 1.6% in 2016 and in 2017 it would reach a growth of 1.4%. Inflation in these industrialized economies has maintained a positive trend, gradually approaching the targets set by its central banks. In the case of Latin America, the region would have closed in 2016 with a contraction of -0.6%, to recover in 2017 with a growth of 1.2%, according to estimates of the International Monetary Fund. On the other hand, the international prices of most primary goods show a growing trend so far this year, especially oil, industrial metals and some foods.","01","17",4
"In the domestic sphere, economic activity expanded at a rate of 6.6% in 2016, being the highest in the region for the third consecutive year. In the monetary sector, the dynamism in total financial system credit continues to the private sector, both in domestic and foreign currency, growing by 11.9% at the end of 2016, above the expansion of nominal GDP. Public finances during the second semester of 2016 have strengthened, as there has been an improvement in tax revenues and a moderation in public spending, with a primary surplus expected for the end of the year, which would contribute to strengthening the sustainability of the public debt.","01","17",5
"In addition, the strengthening of macroeconomic fundamentals was maintained during 2016, when the lowest current account deficit was recorded in the last decade (-1.5% of GDP), influenced by the dynamism of tourism, remittances and national exports. This good performance of the external sector allowed the Gross International Reserves to close the year at historically high levels of US $ 6,047.4 million, equivalent to a coverage of 3.9 months of imports, which gives the Dominican economy greater strength to react to any event adverse and guarantee the relative stability of the foreign exchange market.","01","17",6
"The Central Bank of the Dominican Republic reaffirms its commitment to continue conducting monetary policy aimed at achieving its inflation target and maintaining macroeconomic stability, while continuing to monitor the evolution of the world economy and the domestic situation, In order to adopt the necessary measures in the face of risks regarding price stability and the proper functioning of the financial and payment systems.","01","17",7
"At its monetary policy meeting in January 2018, the Central Bank of the Dominican Republic (BCRD) decided to keep its monetary policy interest rate at 5.25% per annum.","01","18",1
"This decision was based on an exhaustive analysis of the balance of risks around inflation forecasts, the evolution of the main national macroeconomic indicators, the international environment, market expectations and medium-term projections. Inflation for the month of December 2017 was 0.97%, while year-on-year inflation stood at 4.20%, close to the central value of the target range of 4.0% <U+00B1> 1.0% established in the Monetary Program. In turn, core inflation, related to monetary conditions, reached 2.36% year-to-year at the end of 2017. Forecasts indicate that inflation would remain within the target range in the 24-month monetary policy horizon.","01","18",2
"In the international arena, the world economy experienced a growth of 3.2% in 2017, while for 2018 Consensus Forecast (CFC) estimates an expansion rate of 3.3% for the global economy. In 2017, the behavior of the world economy was driven by the performance of advanced economies, particularly by growth rates of 2.3% in the United States of America (USA) and 2.5% in the Euro Zone (ZE). By 2018, CFC projects that the dynamism of the advanced economies would continue with an expansion of 2.7% in the US and 2.2% in the ZE. On the price side, US inflation was 2.1% in 2017 and that of the EZ of 1.4%, while it is expected that by 2018 in both economies the price growth would be similar to last year.","01","18",3
"The recovery continued in Latin America (AL) during 2017, estimating a growth of 1.8% according to Consensus Forescast. By 2018, it is expected that all countries in the region would maintain a positive economic performance, with the sole exception of Venezuela. In that sense, the growth projections of CFC point to an expansion for the region of 2.6% by the end of 2018. In general terms, large economies of Latin America, exporters of commodities, would benefit from the upward trend that is observed in the international prices of primary goods, while at the same time they would be facing favorable international financial conditions in an environment of abundant liquidity worldwide.","01","18",4
"In the domestic context, the economy has reacted favorably to monetary easing measures that were implemented as of August 2017. Since that period, the active interest rate has been significantly reduced and loans to the private sector in national currency have grown in about RD $ 55 billion. The growth of credit reached 12.5% ??year-to-year at the end of January, generating a great dynamism in investment and consumption, which boosted the recovery of domestic demand. Indeed, preliminary information from the Monthly Indicator of Economic Activity (IMAE) indicates a growth of 7.4% in the month of December and an accumulated expansion of 4.6% during the year 2017. The outlook for the Dominican economy in 2018 is positive, when projecting a growth of around 5.5% in the Monetary Program, influenced by greater expansion in the US, our main trading partner, and by the dynamism of credit at the domestic level. Macroeconomic models indicate that growth could be even higher at the end of the year, approaching 6.0%.","01","18",5
"On the other hand, the external sector continues to record a good performance, closing 2017 with a Current Account deficit of -0.2% of GDP, the lowest in thirteen years. Likewise, the positive result of the global balance of payments allowed an accumulation of international reserves of some US $ 730 million, about 4.4 months of importation. The dynamism of foreign exchange generating activities such as tourism, remittances and foreign investment contributed to this remarkable accumulation of international reserves, while at the same time facilitating the maintenance of the relative stability of the exchange rate.","01","18",6
"The Central Bank of the Dominican Republic reaffirms its commitment to conduct monetary policy to achieve its inflation target and to maintain macroeconomic stability, helping to create the conditions for the economy to grow around its potential. In that sense, it will continue to monitor the evolution of the world economy and the domestic situation, in order to adopt the necessary measures against possible risks on price stability and the proper functioning of the financial and payment systems.","01","18",7
"BCRD keeps its monetary policy rate at 5.50% per year","01","19",1
"Santo Domingo, Dominican Republic. - At its January 2019 monetary policy meeting, the Central Bank of the Dominican Republic (BCRD) decided to keep its monetary policy interest rate at 5.50% per annum.","01","19",2
